{
  "id": "sdk-initialize",
  "title": "BACKND Base SDK initialization",
  "product": "backnd-base",
  "route_family_id": "sdk-initialize",
  "route_family": "/sdk-docs/backend/base/sdk-initialize",
  "source_routes": [
    "/sdk-docs/backend/base/sdk-initialize",
    "/sdk-docs/backend/base/multi-project-initialize"
  ],
  "summary": "Describes the explicit SDK initialization area, including synchronous and asynchronous initialization paths, optional custom settings, and basic success and failure patterns.",
  "capabilities": [
    "explain when initialization must occur",
    "differentiate sync and async initialization options",
    "outline the role of custom initialization settings",
    "warn when exact field names should be rechecked upstream"
  ],
  "prerequisites": [
    "BACKND Base SDK is already installed",
    "Credentials or equivalent custom settings are available before the first SDK call",
    "The app initializes the SDK only once during runtime"
  ],
  "common_pitfalls": [
    "Mixing inspector-based settings with custom-setting assumptions",
    "Treating initialization as optional before authenticated or data APIs are called",
    "Hardcoding exact settings without checking the current official docs when freshness matters"
  ],
  "related_topics": [
    "startup",
    "all-errors",
    "function-product"
  ],
  "keywords": [
    "initialize",
    "initializeasync",
    "backendcustomsetting",
    "clientappid",
    "signaturekey",
    "functionauthkey"
  ],
  "verification_required_for": [
    "exact initialization signatures",
    "current custom-setting field names",
    "current async or sync behavior details"
  ],
  "verification_strategy": [
    "Use https://docs.backnd.com plus the source route before generating implementation-ready initialization code.",
    "Do not present exact parameter names or signatures from memory when freshness matters."
  ],
  "last_reviewed": "2026-04-16",
  "public_notes": [
    "Exact initialization signatures should be revalidated from the official docs before code generation in a live project.",
    "This topic is designed for routing and reasoning, not as a replacement for API reference pages."
  ]
}
