{
  "id": "rank",
  "title": "BACKND Base rank (legacy URank, deprecated)",
  "product": "backnd-base",
  "route_family_id": "rank",
  "route_family": "/sdk-docs/backend/base/rank",
  "source_routes": [
    "/sdk-docs/backend/base/leaderboard/difference-to-rank"
  ],
  "summary": "Legacy URank ranking for user and guild. The official rank documentation pages are unpublished (draft) and return 404; the feature has been superseded by the leaderboard topic. Use this topic only to recognize legacy URank usage and to route migration toward leaderboard.",
  "capabilities": [
    "recognize legacy URank calls in existing code",
    "redirect new ranking work to the leaderboard topic",
    "explain that official rank docs pages are unpublished and return 404",
    "point to the leaderboard difference page for migration guidance"
  ],
  "prerequisites": [
    "An existing integration still calls URank functions",
    "Migration to the leaderboard system is being considered"
  ],
  "common_pitfalls": [
    "Linking to /sdk-docs/backend/base/rank pages, which are draft and return 404",
    "Recommending URank for new features instead of leaderboard",
    "Assuming URank and leaderboard updates write to the same group"
  ],
  "related_topics": [
    "leaderboard",
    "game-information",
    "player-data"
  ],
  "keywords": [
    "rank",
    "urank",
    "updateuserscore",
    "랭킹",
    "legacy rank",
    "guild rank"
  ],
  "verification_required_for": [
    "whether a specific URank function still exists in the current SDK",
    "exact migration steps from URank to leaderboard"
  ],
  "verification_strategy": [
    "Do not link rank docs pages; they are draft and return 404. Route to https://docs.backnd.com/sdk-docs/backend/base/leaderboard instead.",
    "Confirm any remaining URank SDK support and migration details from the leaderboard/difference-to-rank page."
  ],
  "last_reviewed": "2026-06-09",
  "public_notes": [
    "Retained only as a legacy router: rank/URank is deprecated in favor of leaderboard.",
    "All canonical rank doc routes are unpublished; leaderboard is the current source of truth."
  ]
}
